{
  "$defs": {
    "digest": {
      "pattern": "^sha256:[0-9a-f]{64}$",
      "type": "string"
    },
    "fullPlan": {
      "additionalProperties": false,
      "properties": {
        "digest": {
          "const": "sha256:c8e10469fcf310e913f7520990b833e259daf5d0d3144defdcd4ba31d5b46524"
        },
        "path": {
          "const": "docs/plans/ai-agent-workflow-full-implementation-plan.md"
        },
        "role": {
          "const": "full-implementation-plan"
        }
      },
      "required": [
        "role",
        "path",
        "digest"
      ],
      "type": "object"
    },
    "lineage": {
      "additionalProperties": false,
      "properties": {
        "digest": {
          "const": "sha256:671d17390fc3e55289cd66048df2fa4ddd82280525eb63f207e712d085c9a822"
        },
        "path": {
          "const": "agent-workflows/evidence/current-canonical-lineage.json"
        }
      },
      "required": [
        "path",
        "digest"
      ],
      "type": "object"
    },
    "predecessor": {
      "additionalProperties": false,
      "properties": {
        "digest": {
          "const": "sha256:673114ec3e1ea69fcd9580805b7f872895062253a0a1ccc352f40f281ccc3070"
        },
        "path": {
          "const": "agent-workflows/manifests/s0-source-transition-authority.json"
        }
      },
      "required": [
        "path",
        "digest"
      ],
      "type": "object"
    },
    "stepCatalog": {
      "additionalProperties": false,
      "properties": {
        "digest": {
          "const": "sha256:5bfbb5342bb8d3fbc1f85876ce588adb00eedaa4d961e41b14121603ead1da4b"
        },
        "path": {
          "const": "docs/plans/ai-agent-workflow-step-catalog.md"
        },
        "role": {
          "const": "step-catalog"
        }
      },
      "required": [
        "role",
        "path",
        "digest"
      ],
      "type": "object"
    }
  },
  "$id": "s0-source-transition-current-authority-v1.schema.json",
  "$schema": "https://json-schema.org/draft/2020-12/schema",
  "additionalProperties": false,
  "properties": {
    "authority_id": {
      "const": "ai-agent-workflow-s0-current-source-transition-v1"
    },
    "current_canonical_lineage": {
      "$ref": "#/$defs/lineage"
    },
    "current_sources": {
      "items": false,
      "maxItems": 2,
      "minItems": 2,
      "prefixItems": [
        {
          "$ref": "#/$defs/fullPlan"
        },
        {
          "$ref": "#/$defs/stepCatalog"
        }
      ],
      "type": "array"
    },
    "predecessor_authority": {
      "$ref": "#/$defs/predecessor"
    },
    "schema": {
      "const": "s0-source-transition-current-authority/v1"
    }
  },
  "required": [
    "schema",
    "authority_id",
    "predecessor_authority",
    "current_canonical_lineage",
    "current_sources"
  ],
  "type": "object"
}
