{
  "authority_id": "ai-agent-workflow-s0-current-source-transition-v1",
  "current_canonical_lineage": {
    "digest": "sha256:671d17390fc3e55289cd66048df2fa4ddd82280525eb63f207e712d085c9a822",
    "path": "agent-workflows/evidence/current-canonical-lineage.json"
  },
  "current_sources": [
    {
      "digest": "sha256:c8e10469fcf310e913f7520990b833e259daf5d0d3144defdcd4ba31d5b46524",
      "path": "docs/plans/ai-agent-workflow-full-implementation-plan.md",
      "role": "full-implementation-plan"
    },
    {
      "digest": "sha256:5bfbb5342bb8d3fbc1f85876ce588adb00eedaa4d961e41b14121603ead1da4b",
      "path": "docs/plans/ai-agent-workflow-step-catalog.md",
      "role": "step-catalog"
    }
  ],
  "predecessor_authority": {
    "digest": "sha256:673114ec3e1ea69fcd9580805b7f872895062253a0a1ccc352f40f281ccc3070",
    "path": "agent-workflows/manifests/s0-source-transition-authority.json"
  },
  "schema": "s0-source-transition-current-authority/v1"
}
